site_id,site_name,country_code,country_name
si_0001,"Wheeler, Harvey and Barnes Research Center",US,United States
si_0002,"Cunningham, Stewart and Green Research Center",US,United States
si_0003,"Moran, Allen and Foster Research Center",US,United States
si_0004,"Brewer, Bryant and Hickman Research Center",US,United States
si_0005,Smith PLC Research Center,US,United States
si_0006,"Ferrell, Jones and Lewis Research Center",US,United States
si_0007,Anderson-Bailey Research Center,US,United States
si_0008,Suarez LLC Research Center,US,United States
si_0009,Moore-Bass Research Center,US,United States
si_0010,"Turner, Riggs and Roman Research Center",US,United States
si_0011,"Smith, Montoya and Evans Research Center",US,United States
si_0012,"Garcia, Humphrey and Baker Research Center",US,United States
si_0013,Newton and Sons Research Center,US,United States
si_0014,Campbell-Clark Research Center,US,United States
si_0015,Harris-Walters Research Center,US,United States
si_0016,Wagner-King Research Center,US,United States
si_0017,Davis Group Research Center,US,United States
si_0018,Williams-Cook Research Center,US,United States
si_0019,Walsh LLC Research Center,US,United States
si_0020,Figueroa PLC Research Center,US,United States
si_0021,"Patterson, Smith and Jones Research Center",US,United States
si_0022,"Mckee, Gardner and Davenport Research Center",US,United States
si_0023,"Tran, Jordan and Williams Research Center",US,United States
si_0024,Nolan-Flynn Research Center,US,United States
si_0025,Nolan and Sons Research Center,US,United States
si_0026,"Wright, Garcia and Deleon Research Center",US,United States
si_0027,Dickson-Brady Research Center,US,United States
si_0028,Hancock and Sons Research Center,US,United States
si_0029,Johnson-Doyle Research Center,US,United States
si_0030,Patton-Jenkins Research Center,US,United States
si_0031,"Shields, Cochran and Adams Research Center",US,United States
si_0032,"Rodriguez, Brennan and Garrison Research Center",US,United States
si_0033,Gonzalez Group Research Center,US,United States
si_0034,Torres-Pope Research Center,US,United States
si_0035,Walker Ltd Research Center,US,United States
si_0036,Ross LLC Research Center,US,United States
si_0037,Rasmussen LLC Research Center,US,United States
si_0038,May-Ross Research Center,US,United States
si_0039,"Rivera, Johnson and Wiley Research Center",US,United States
si_0040,White-Estes Research Center,US,United States
si_0041,Johnson-Carlson Research Center,US,United States
si_0042,Chandler-Edwards Research Center,US,United States
si_0043,"Joyce, Wilson and Lam Research Center",US,United States
si_0044,Scott Ltd Research Center,US,United States
si_0045,Smith-Frost Research Center,US,United States
si_0046,"Mcdaniel, Bentley and Mclaughlin Research Center",US,United States
si_0047,Diaz Inc Research Center,US,United States
si_0048,"Mccall, Hanson and Alvarado Research Center",US,United States
si_0049,Cortez LLC Research Center,US,United States
si_0050,"Parker, Ortiz and Powell Research Center",US,United States
si_0051,Spencer-Lee Research Center,US,United States
si_0052,"Bentley, Byrd and Orr Research Center",US,United States
si_0053,"Carroll, Sullivan and Bass Research Center",US,United States
si_0054,Mitchell-Jordan Research Center,US,United States
si_0055,"Lawson, Morris and Ramos Research Center",US,United States
si_0056,"Lewis, Kennedy and Santana Research Center",US,United States
si_0057,"Jackson, Miller and Robertson Research Center",US,United States
si_0058,"Harvey, Davis and Crane Research Center",US,United States
si_0059,Chambers and Sons Research Center,US,United States
si_0060,Hernandez Inc Research Center,US,United States
si_0061,Riggs PLC Research Center,US,United States
si_0062,Gibson Ltd Research Center,US,United States
si_0063,"Lee, Horton and Snyder Research Center",US,United States
si_0064,Hernandez Ltd Research Center,US,United States
si_0065,Stafford Inc Research Center,US,United States
si_0066,Robinson-Brock Research Center,US,United States
si_0067,"Holmes, Williams and Wright Research Center",US,United States
si_0068,Bryant Group Research Center,US,United States
si_0069,"Schmidt, Hansen and Stewart Research Center",US,United States
si_0070,Salazar-Ball Research Center,US,United States
si_0071,"Simmons, Meadows and Griffin Research Center",US,United States
si_0072,Manning Group Research Center,US,United States
si_0073,Green-Wright Research Center,US,United States
si_0074,"Ramirez, Strickland and Washington Research Center",US,United States
si_0075,Hill Inc Research Center,US,United States
si_0076,"Mitchell, Nelson and Flores Research Center",US,United States
si_0077,"Miller, Hernandez and Reyes Research Center",US,United States
si_0078,Mccarthy Inc Research Center,US,United States
si_0079,Russell-Daniels Research Center,US,United States
si_0080,Brown-Wall Research Center,US,United States
si_0081,Stein-Silva Research Center,US,United States
si_0082,"Smith, Gilmore and Johnston Research Center",US,United States
si_0083,Smith-Bell Research Center,US,United States
si_0084,Castaneda-Ashley Research Center,US,United States
si_0085,Medina-Navarro Research Center,US,United States
si_0086,"Hurst, Freeman and Nelson Research Center",US,United States
si_0087,Johnson-Rogers Research Center,US,United States
si_0088,"Yates, Ramsey and Pittman Research Center",US,United States
si_0089,Hooper PLC Research Center,US,United States
si_0090,Meadows PLC Research Center,US,United States
si_0091,"Alvarado, Miller and Patterson Research Center",US,United States
si_0092,White-Green Research Center,US,United States
si_0093,Lewis-Murphy Research Center,US,United States
si_0094,Ramirez-Bean Research Center,US,United States
si_0095,King-Miller Research Center,US,United States
si_0096,Curry Inc Research Center,US,United States
si_0097,Walker-Jones Research Center,US,United States
si_0098,"Williams, Johnson and Wright Research Center",US,United States
si_0099,Howell and Sons Research Center,US,United States
si_0100,Wells Inc Research Center,US,United States
si_0101,"Gould, Marshall and Scott Research Center",US,United States
si_0102,Jackson-Lawson Research Center,US,United States
si_0103,"Higgins, Strickland and Martin Research Center",US,United States
si_0104,Rodriguez-Johnson Research Center,US,United States
si_0105,Johnston-Odonnell Research Center,US,United States
si_0106,Sanders-Espinoza Research Center,US,United States
si_0107,Vargas Ltd Research Center,US,United States
si_0108,Garcia LLC Research Center,US,United States
si_0109,"Burke, Martinez and Riggs Research Center",US,United States
si_0110,Reed Group Research Center,US,United States
si_0111,"Wood, Hunter and Peterson Research Center",US,United States
si_0112,Short-Garcia Research Center,US,United States
si_0113,Reid-Poole Research Center,US,United States
si_0114,"Hernandez, Thompson and Boyd Research Center",US,United States
si_0115,"Nelson, Morton and Medina Research Center",US,United States
si_0116,Marshall-Petersen Research Center,US,United States
si_0117,"Adams, Christian and Rivas Research Center",US,United States
si_0118,Ramirez Group Research Center,US,United States
si_0119,Christensen PLC Research Center,US,United States
si_0120,"Barnett, Rogers and Snyder Research Center",US,United States
si_0121,White-Lewis Research Center,US,United States
si_0122,Peterson-Beard Research Center,US,United States
si_0123,"Beard, Peters and Black Research Center",US,United States
si_0124,Miller Ltd Research Center,FR,France
si_0125,Freeman-Chang Research Center,FR,France
si_0126,"Alvarez, Joseph and West Research Center",FR,France
si_0127,Davis and Sons Research Center,FR,France
si_0128,Holt-Torres Research Center,FR,France
si_0129,"Wood, Tran and Cooper Research Center",FR,France
si_0130,"Pierce, Bell and Chavez Research Center",FR,France
si_0131,King-Martinez Research Center,FR,France
si_0132,Stewart Ltd Research Center,FR,France
si_0133,"Tapia, Vaughn and Lee Research Center",FR,France
si_0134,"Washington, Hardy and Bray Research Center",FR,France
si_0135,"Carlson, Hooper and Wall Research Center",FR,France
si_0136,Perez-White Research Center,FR,France
si_0137,Erickson and Sons Research Center,FR,France
si_0138,Williams-Brown Research Center,FR,France
si_0139,Terry-Martinez Research Center,FR,France
si_0140,Garcia-Smith Research Center,FR,France
si_0141,Harrison-Alexander Research Center,FR,France
si_0142,Sheppard LLC Research Center,FR,France
si_0143,Wilson-Jones Research Center,FR,France
si_0144,Jones-Soto Research Center,FR,France
si_0145,Hernandez PLC Research Center,FR,France
si_0146,Miller-Wright Research Center,FR,France
si_0147,"Duran, Obrien and Gibbs Research Center",FR,France
si_0148,Rowe Group Research Center,FR,France
si_0149,Kerr-Evans Research Center,FR,France
si_0150,"Branch, Torres and Oliver Research Center",FR,France
si_0151,"Choi, Garcia and Farmer Research Center",FR,France
si_0152,"Clark, Guerrero and Moore Research Center",FR,France
si_0153,Arnold and Sons Research Center,FR,France
si_0154,Ortiz Ltd Research Center,FR,France
si_0155,"Harrison, Johnson and Roberts Research Center",FR,France
si_0156,Warner-Gibson Research Center,FR,France
si_0157,"Hall, Baker and Moody Research Center",FR,France
si_0158,"Guerrero, Peck and Coleman Research Center",FR,France
si_0159,"Walker, Hernandez and Baker Research Center",FR,France
si_0160,Jones and Sons Research Center,FR,France
si_0161,Larson-Holloway Research Center,FR,France
si_0162,Gonzales-Harrison Research Center,FR,France
si_0163,Lyons-Bender Research Center,FR,France
si_0164,"Fernandez, Kim and George Research Center",FR,France
si_0165,Navarro-Munoz Research Center,FR,France
si_0166,Davis Ltd Research Center,FR,France
si_0167,"Matthews, Smith and Hubbard Research Center",FR,France
si_0168,Johnston-Hines Research Center,FR,France
si_0169,Ruiz Ltd Research Center,FR,France
si_0170,Moon-White Research Center,FR,France
si_0171,"Graham, Olsen and Costa Research Center",FR,France
si_0172,Bailey-Cook Research Center,FR,France
si_0173,"Garcia, Martin and Jenkins Research Center",FR,France
si_0174,Roberts-Landry Research Center,FR,France
si_0175,"Johnson, Miller and King Research Center",FR,France
si_0176,Cordova Group Research Center,FR,France
si_0177,"Bryan, Smith and Booth Research Center",FR,France
si_0178,Gutierrez-Lopez Research Center,FR,France
si_0179,Dean-Jimenez Research Center,FR,France
si_0180,Wolf-Harris Research Center,FR,France
si_0181,"Anderson, Roberts and Gilmore Research Center",FR,France
si_0182,Martinez-Dudley Research Center,FR,France
si_0183,"Lloyd, Mckinney and Collins Research Center",FR,France
si_0184,Tran Inc Research Center,DE,Germany
si_0185,Gay Inc Research Center,DE,Germany
si_0186,Valentine-Holland Research Center,DE,Germany
si_0187,Jimenez Ltd Research Center,DE,Germany
si_0188,Hicks-Hill Research Center,DE,Germany
si_0189,Baird-Sanchez Research Center,DE,Germany
si_0190,"Thomas, Lee and Greene Research Center",DE,Germany
si_0191,"Suarez, Shields and Hill Research Center",DE,Germany
si_0192,Morgan-French Research Center,DE,Germany
si_0193,Hoover-Campbell Research Center,DE,Germany
si_0194,Monroe-Carpenter Research Center,DE,Germany
si_0195,"Burns, Hernandez and Ryan Research Center",DE,Germany
si_0196,Cook-Hines Research Center,DE,Germany
si_0197,Gibson-Morris Research Center,DE,Germany
si_0198,Pollard and Sons Research Center,DE,Germany
si_0199,"Reyes, Chase and Jenkins Research Center",DE,Germany
si_0200,Garner-Thornton Research Center,DE,Germany
si_0201,Hughes-Alvarado Research Center,DE,Germany
si_0202,"Pollard, Simpson and Johnson Research Center",DE,Germany
si_0203,"Sanford, Rivera and Garcia Research Center",DE,Germany
si_0204,Garcia-Lozano Research Center,DE,Germany
si_0205,Bowen Group Research Center,DE,Germany
si_0206,"Booker, Jones and Harrington Research Center",DE,Germany
si_0207,Morgan-Schwartz Research Center,DE,Germany
si_0208,"Miller, Murphy and Craig Research Center",DE,Germany
si_0209,"James, Stewart and Higgins Research Center",DE,Germany
si_0210,Brennan-Johnson Research Center,DE,Germany
si_0211,Young Ltd Research Center,DE,Germany
si_0212,Bright-Francis Research Center,DE,Germany
si_0213,Good-Hodges Research Center,DE,Germany
si_0214,"Brennan, Wallace and Benson Research Center",DE,Germany
si_0215,Williams Inc Research Center,DE,Germany
si_0216,Howard-Jordan Research Center,DE,Germany
si_0217,Schmidt PLC Research Center,DE,Germany
si_0218,"Sparks, Jackson and Miller Research Center",DE,Germany
si_0219,Harvey-Allen Research Center,DE,Germany
si_0220,"Thomas, Murray and King Research Center",DE,Germany
si_0221,Estrada-Nolan Research Center,DE,Germany
si_0222,Santana-Byrd Research Center,DE,Germany
si_0223,Jones LLC Research Center,DE,Germany
si_0224,"Evans, Hayden and Vaughn Research Center",DE,Germany
si_0225,Bruce-Gonzalez Research Center,DE,Germany
si_0226,Castaneda-Rodriguez Research Center,DE,Germany
si_0227,Armstrong-Andrews Research Center,DE,Germany
si_0228,"Phillips, Spence and Barrett Research Center",DE,Germany
si_0229,Smith-Grimes Research Center,DE,Germany
si_0230,"Beltran, Lozano and Mcgee Research Center",DE,Germany
si_0231,Parsons-Hall Research Center,DE,Germany
si_0232,Robinson-Lee Research Center,DE,Germany
si_0233,Byrd-Le Research Center,DE,Germany
si_0234,"Becker, Taylor and Davis Research Center",DE,Germany
si_0235,"Lucas, Parker and Alexander Research Center",DE,Germany
si_0236,"Diaz, Anderson and Browning Research Center",GB,United Kingdom
si_0237,Burgess-Thompson Research Center,GB,United Kingdom
si_0238,Buchanan LLC Research Center,GB,United Kingdom
si_0239,"Shaw, Nelson and Martin Research Center",GB,United Kingdom
si_0240,Coffey-Phillips Research Center,GB,United Kingdom
si_0241,Brock-Mcdonald Research Center,GB,United Kingdom
si_0242,Taylor and Sons Research Center,GB,United Kingdom
si_0243,"Ramsey, Whitney and Coffey Research Center",GB,United Kingdom
si_0244,"Diaz, Gibbs and Smith Research Center",GB,United Kingdom
si_0245,"Martinez, Richardson and Curry Research Center",GB,United Kingdom
si_0246,Richards-Carson Research Center,GB,United Kingdom
si_0247,Rodriguez-Hall Research Center,GB,United Kingdom
si_0248,Harvey PLC Research Center,GB,United Kingdom
si_0249,Herman-Walker Research Center,GB,United Kingdom
si_0250,Reid Group Research Center,GB,United Kingdom
si_0251,"Turner, Ortiz and Taylor Research Center",GB,United Kingdom
si_0252,Torres Group Research Center,GB,United Kingdom
si_0253,Davis PLC Research Center,GB,United Kingdom
si_0254,Price LLC Research Center,GB,United Kingdom
si_0255,"Avery, Horton and Fernandez Research Center",GB,United Kingdom
si_0256,"Newton, Moore and Perry Research Center",GB,United Kingdom
si_0257,Bass PLC Research Center,GB,United Kingdom
si_0258,Crosby-Ramirez Research Center,GB,United Kingdom
si_0259,"Wood, Ramos and Sampson Research Center",GB,United Kingdom
si_0260,Garcia-Jennings Research Center,GB,United Kingdom
si_0261,"Winters, Newman and Brown Research Center",GB,United Kingdom
si_0262,Lopez-Martinez Research Center,GB,United Kingdom
si_0263,Davis-Lewis Research Center,GB,United Kingdom
si_0264,"Harper, Smith and Buchanan Research Center",GB,United Kingdom
si_0265,Zhang PLC Research Center,GB,United Kingdom
si_0266,Jones PLC Research Center,GB,United Kingdom
si_0267,Willis and Sons Research Center,GB,United Kingdom
si_0268,Schroeder-Kramer Research Center,GB,United Kingdom
si_0269,"Smith, Garrison and Thomas Research Center",GB,United Kingdom
si_0270,Fernandez and Sons Research Center,GB,United Kingdom
si_0271,Guerrero Inc Research Center,GB,United Kingdom
si_0272,Smith and Sons Research Center,GB,United Kingdom
si_0273,"Morris, Thompson and Williams Research Center",GB,United Kingdom
si_0274,"Fisher, Wilson and Brown Research Center",GB,United Kingdom
si_0275,Strickland-Palmer Research Center,GB,United Kingdom
si_0276,Hayes and Sons Research Center,GB,United Kingdom
si_0277,"Williams, Logan and Camacho Research Center",GB,United Kingdom
si_0278,"Turner, Schneider and Johnson Research Center",GB,United Kingdom
si_0279,Boone-Simmons Research Center,GB,United Kingdom
si_0280,Henry Group Research Center,GB,United Kingdom
si_0281,Lam LLC Research Center,GB,United Kingdom
si_0282,"Hernandez, Martinez and Weber Research Center",GB,United Kingdom
si_0283,"Kelley, Nguyen and Vang Research Center",GB,United Kingdom
si_0284,"Phillips, Wagner and Jordan Research Center",GB,United Kingdom
si_0285,"Wilson, Pena and Rich Research Center",GB,United Kingdom
si_0286,"Le, Lewis and Hayes Research Center",GB,United Kingdom
si_0287,Gutierrez Group Research Center,GB,United Kingdom
si_0288,Perry-Davis Research Center,GB,United Kingdom
si_0289,Edwards-Scott Research Center,GB,United Kingdom
si_0290,Mcdaniel Group Research Center,GB,United Kingdom
si_0291,Davis Inc Research Center,GB,United Kingdom
si_0292,Reynolds Ltd Research Center,ES,Spain
si_0293,"Watson, Anderson and Brown Research Center",ES,Spain
si_0294,"Hoffman, Santiago and Jenkins Research Center",ES,Spain
si_0295,"Pugh, Henderson and Moon Research Center",ES,Spain
si_0296,Schmitt PLC Research Center,ES,Spain
si_0297,Bell-Lane Research Center,ES,Spain
si_0298,Moore Group Research Center,ES,Spain
si_0299,Boone LLC Research Center,ES,Spain
si_0300,"Richardson, Farmer and Andrews Research Center",ES,Spain
si_0301,Bruce-Villegas Research Center,ES,Spain
si_0302,"Austin, Day and Johnson Research Center",ES,Spain
si_0303,"Gallegos, Adams and White Research Center",ES,Spain
si_0304,"Farmer, Dorsey and Bell Research Center",ES,Spain
si_0305,Kane PLC Research Center,ES,Spain
si_0306,"Morales, Thomas and Schultz Research Center",ES,Spain
si_0307,Davis PLC Research Center,ES,Spain
si_0308,Bennett Group Research Center,ES,Spain
si_0309,Moore-Collins Research Center,ES,Spain
si_0310,Frank-Bradley Research Center,ES,Spain
si_0311,Ware and Sons Research Center,ES,Spain
si_0312,Webster Inc Research Center,ES,Spain
si_0313,"Miller, Ramos and Coleman Research Center",ES,Spain
si_0314,"Ramos, Nelson and Fischer Research Center",ES,Spain
si_0315,Reed Inc Research Center,ES,Spain
si_0316,Gregory-Watkins Research Center,ES,Spain
si_0317,"Estrada, Williams and Foster Research Center",ES,Spain
si_0318,"Brown, Harris and Dougherty Research Center",ES,Spain
si_0319,Duran LLC Research Center,ES,Spain
si_0320,Wilson-Jimenez Research Center,ES,Spain
si_0321,Thompson-James Research Center,ES,Spain
si_0322,"Hall, Hansen and Barnett Research Center",ES,Spain
si_0323,Jones-Hensley Research Center,ES,Spain
si_0324,Graham Group Research Center,ES,Spain
si_0325,Atkins PLC Research Center,ES,Spain
si_0326,Berry-Mckinney Research Center,ES,Spain
si_0327,Roberts-Sullivan Research Center,ES,Spain
si_0328,Jackson-Meza Research Center,ES,Spain
si_0329,Collier-Gillespie Research Center,ES,Spain
si_0330,Kim Inc Research Center,ES,Spain
si_0331,Graham Group Research Center,ES,Spain
si_0332,"Miller, Harrell and Reese Research Center",ES,Spain
si_0333,Cook and Sons Research Center,ES,Spain
si_0334,Dixon Inc Research Center,ES,Spain
si_0335,"Hicks, Bullock and Bailey Research Center",ES,Spain
si_0336,"Mullen, Brewer and Hernandez Research Center",ES,Spain
si_0337,Thomas and Sons Research Center,ES,Spain
si_0338,Morrison Ltd Research Center,ES,Spain
si_0339,Thompson Ltd Research Center,ES,Spain
si_0340,Marshall-Elliott Research Center,ES,Spain
si_0341,"Cole, Glass and Cunningham Research Center",ES,Spain
si_0342,"Downs, Morris and Maddox Research Center",ES,Spain
si_0343,Hernandez-Jones Research Center,ES,Spain
si_0344,Welch-Hogan Research Center,IT,Italy
si_0345,"Brown, Romero and Collins Research Center",IT,Italy
si_0346,Johnson-Wood Research Center,IT,Italy
si_0347,Jones-Lin Research Center,IT,Italy
si_0348,Gilbert PLC Research Center,IT,Italy
si_0349,Ford-Spencer Research Center,IT,Italy
si_0350,"Huang, Cole and Pacheco Research Center",IT,Italy
si_0351,"Lopez, Jacobs and Mason Research Center",IT,Italy
si_0352,Hayes LLC Research Center,IT,Italy
si_0353,"Miller, Lucas and Williams Research Center",IT,Italy
si_0354,"Kim, Gonzales and Mills Research Center",IT,Italy
si_0355,Cox LLC Research Center,IT,Italy
si_0356,Ortiz-Morgan Research Center,IT,Italy
si_0357,"Williams, Mccoy and Cook Research Center",IT,Italy
si_0358,Davis-Gregory Research Center,IT,Italy
si_0359,King-York Research Center,IT,Italy
si_0360,"Marks, Cook and Aguilar Research Center",IT,Italy
si_0361,Rangel LLC Research Center,IT,Italy
si_0362,"Hale, Myers and Larson Research Center",IT,Italy
si_0363,Collins Group Research Center,IT,Italy
si_0364,"Conner, Li and Santiago Research Center",IT,Italy
si_0365,"Osborn, Gaines and Davis Research Center",IT,Italy
si_0366,"Henderson, Cox and Cox Research Center",IT,Italy
si_0367,Bean LLC Research Center,IT,Italy
si_0368,Lee-Cooke Research Center,IT,Italy
si_0369,Jones Inc Research Center,IT,Italy
si_0370,"Wise, Conley and Stephenson Research Center",IT,Italy
si_0371,Stanley PLC Research Center,IT,Italy
si_0372,Harper and Sons Research Center,IT,Italy
si_0373,White Ltd Research Center,IT,Italy
si_0374,"Lamb, Martin and Kim Research Center",IT,Italy
si_0375,Diaz-Ball Research Center,IT,Italy
si_0376,Bishop-Goodwin Research Center,IT,Italy
si_0377,Young-Allen Research Center,IT,Italy
si_0378,Mckee-Lee Research Center,IT,Italy
si_0379,"Valentine, Joyce and Murray Research Center",IT,Italy
si_0380,Strickland-Shaw Research Center,IT,Italy
si_0381,Burch-Montoya Research Center,IT,Italy
si_0382,"Taylor, Wright and Davidson Research Center",IT,Italy
si_0383,Spencer-Garcia Research Center,JP,Japan
si_0384,"Rosales, Mitchell and Hines Research Center",JP,Japan
si_0385,Cole-Palmer Research Center,JP,Japan
si_0386,Davis-Lozano Research Center,JP,Japan
si_0387,Wilkerson-Arias Research Center,JP,Japan
si_0388,Brown-Shaw Research Center,JP,Japan
si_0389,Hughes Inc Research Center,JP,Japan
si_0390,Walker-Flores Research Center,JP,Japan
si_0391,Combs Ltd Research Center,JP,Japan
si_0392,Moody-Taylor Research Center,JP,Japan
si_0393,Lowery-Kennedy Research Center,JP,Japan
si_0394,Blake Group Research Center,JP,Japan
si_0395,Gilbert-Bullock Research Center,JP,Japan
si_0396,Scott and Sons Research Center,JP,Japan
si_0397,"Bentley, Lynch and Henderson Research Center",JP,Japan
si_0398,Young-Martinez Research Center,JP,Japan
si_0399,Barnes PLC Research Center,JP,Japan
si_0400,Brown-Copeland Research Center,JP,Japan
si_0401,Carlson-Smith Research Center,JP,Japan
si_0402,"Andrews, Higgins and Carter Research Center",JP,Japan
si_0403,Mendez and Sons Research Center,JP,Japan
si_0404,"Butler, Beck and Miller Research Center",JP,Japan
si_0405,Jones-Fox Research Center,JP,Japan
si_0406,"Hartman, Romero and Smith Research Center",JP,Japan
si_0407,Williams-Hughes Research Center,JP,Japan
si_0408,King-Smith Research Center,JP,Japan
si_0409,Cooper Ltd Research Center,JP,Japan
si_0410,"Fuller, Ingram and Moss Research Center",JP,Japan
si_0411,Anderson-Bell Research Center,JP,Japan
si_0412,Li-Thompson Research Center,JP,Japan
si_0413,"Marshall, Dominguez and Welch Research Center",JP,Japan
si_0414,Brown Group Research Center,JP,Japan
si_0415,Carter Inc Research Center,JP,Japan
si_0416,Blackwell LLC Research Center,JP,Japan
si_0417,Robertson-Hays Research Center,JP,Japan
si_0418,"Kennedy, Johnson and Lucas Research Center",JP,Japan
si_0419,Kelly-Norman Research Center,JP,Japan
si_0420,"Rivera, Martinez and Richardson Research Center",JP,Japan
si_0421,Paul-Kline Research Center,JP,Japan
si_0422,Morgan-Lopez Research Center,JP,Japan
si_0423,"Jimenez, Glass and Stone Research Center",CA,Canada
si_0424,Acosta Inc Research Center,CA,Canada
si_0425,Morrison-Short Research Center,CA,Canada
si_0426,"Carter, Garcia and Murphy Research Center",CA,Canada
si_0427,Parker-Morrison Research Center,CA,Canada
si_0428,Jackson-Wallace Research Center,CA,Canada
si_0429,Williams-Berg Research Center,CA,Canada
si_0430,Mendez-Graham Research Center,CA,Canada
si_0431,"Whitney, Gould and Jones Research Center",CA,Canada
si_0432,"Sullivan, Palmer and Brady Research Center",CA,Canada
si_0433,Cisneros and Sons Research Center,CA,Canada
si_0434,"Gregory, Kim and Martinez Research Center",CA,Canada
si_0435,Osborne LLC Research Center,CA,Canada
si_0436,Reyes-Bradley Research Center,CA,Canada
si_0437,"Hernandez, Cole and Watson Research Center",CA,Canada
si_0438,Hines-Berry Research Center,CA,Canada
si_0439,"Richardson, Edwards and Ramirez Research Center",CA,Canada
si_0440,Johnson and Sons Research Center,CA,Canada
si_0441,Holmes-Mcintyre Research Center,CA,Canada
si_0442,Green LLC Research Center,CA,Canada
si_0443,"Griffin, Davies and Mitchell Research Center",CA,Canada
si_0444,Gonzalez-Taylor Research Center,CA,Canada
si_0445,Hayes Ltd Research Center,CA,Canada
si_0446,Osborn-Cochran Research Center,CA,Canada
si_0447,Contreras-Mckinney Research Center,CA,Canada
si_0448,"Daniels, Vance and York Research Center",CA,Canada
si_0449,"Mckinney, Graves and Thompson Research Center",CA,Canada
si_0450,Hicks-Martinez Research Center,CA,Canada
si_0451,Conner and Sons Research Center,CA,Canada
si_0452,Johnson-Spencer Research Center,CA,Canada
si_0453,Mcdonald-Bird Research Center,CA,Canada
si_0454,Salazar Inc Research Center,CA,Canada
si_0455,Parker Ltd Research Center,CA,Canada
si_0456,"Mendoza, Jenkins and Ortiz Research Center",CA,Canada
si_0457,"Jones, Compton and Day Research Center",CA,Canada
si_0458,Owens-Holmes Research Center,CA,Canada
si_0459,Humphrey PLC Research Center,CA,Canada
si_0460,"Matthews, Saunders and Anderson Research Center",CA,Canada
