site_id,site_name,country_code,country_name
si_0461,"Bartlett, Brown and Martinez Research Center",CA,Canada
si_0462,Torres and Sons Research Center,CA,Canada
si_0463,Donovan-Perez Research Center,CA,Canada
si_0464,"Jacobson, Singleton and King Research Center",CA,Canada
si_0465,"Huber, Hill and Weber Research Center",CA,Canada
si_0466,"Ferguson, Shaw and Jackson Research Center",CA,Canada
si_0467,"Moore, Hopkins and Le Research Center",CA,Canada
si_0468,"Morgan, Bradshaw and Williams Research Center",CA,Canada
si_0469,Miller Ltd Research Center,AU,Australia
si_0470,"Baker, Clark and Armstrong Research Center",AU,Australia
si_0471,"Fowler, Jimenez and Burton Research Center",AU,Australia
si_0472,May-Turner Research Center,AU,Australia
si_0473,Ballard Ltd Research Center,AU,Australia
si_0474,Evans-Jones Research Center,AU,Australia
si_0475,Moore Group Research Center,AU,Australia
si_0476,Marshall-Peterson Research Center,AU,Australia
si_0477,Edwards Ltd Research Center,AU,Australia
si_0478,Gross-Valencia Research Center,AU,Australia
si_0479,Anderson-Wood Research Center,AU,Australia
si_0480,"Rodriguez, Allen and Martinez Research Center",AU,Australia
si_0481,Wright-Davis Research Center,AU,Australia
si_0482,Dougherty-Lin Research Center,AU,Australia
si_0483,Wright-Grimes Research Center,AU,Australia
si_0484,Li PLC Research Center,AU,Australia
si_0485,"Edwards, Hines and Jimenez Research Center",AU,Australia
si_0486,"Owens, Koch and Jimenez Research Center",AU,Australia
si_0487,Landry PLC Research Center,AU,Australia
si_0488,Levy-Lewis Research Center,AU,Australia
si_0489,Williams-Campbell Research Center,AU,Australia
si_0490,"Khan, Pena and Ruiz Research Center",AU,Australia
si_0491,"Smith, Rodriguez and Anderson Research Center",AU,Australia
si_0492,Luna-Gallagher Research Center,AU,Australia
si_0493,Williams-Williams Research Center,AU,Australia
si_0494,"Lee, Tran and Jones Research Center",AU,Australia
si_0495,"Cole, Pierce and Bryan Research Center",AU,Australia
si_0496,"Becker, Wilson and Hester Research Center",AU,Australia
si_0497,Brooks-Hatfield Research Center,AU,Australia
si_0498,"Mcmillan, Fischer and Gonzalez Research Center",AU,Australia
si_0499,"Morales, Williams and Williams Research Center",AU,Australia
si_0500,"Cook, Wells and Bryant Research Center",AU,Australia
si_0501,"Barry, Taylor and Velazquez Research Center",AU,Australia
si_0502,Martin-Ewing Research Center,BR,Brazil
si_0503,"Kirby, Wheeler and Romero Research Center",BR,Brazil
si_0504,"Patel, Erickson and Evans Research Center",BR,Brazil
si_0505,Richardson Ltd Research Center,BR,Brazil
si_0506,Whitney PLC Research Center,BR,Brazil
si_0507,Robles-Swanson Research Center,BR,Brazil
si_0508,"Soto, Carlson and Baker Research Center",BR,Brazil
si_0509,"Patton, Parsons and Lane Research Center",BR,Brazil
si_0510,"Williams, Castillo and Warren Research Center",BR,Brazil
si_0511,"Harvey, Randall and Hernandez Research Center",BR,Brazil
si_0512,"Allen, Armstrong and Graves Research Center",BR,Brazil
si_0513,Smith LLC Research Center,BR,Brazil
si_0514,Hernandez-Vaughn Research Center,BR,Brazil
si_0515,Shaw-Carr Research Center,BR,Brazil
si_0516,Salas-Fitzgerald Research Center,BR,Brazil
si_0517,Thornton PLC Research Center,BR,Brazil
si_0518,Hoffman Ltd Research Center,BR,Brazil
si_0519,Fox-Edwards Research Center,BR,Brazil
si_0520,Stevens PLC Research Center,BR,Brazil
si_0521,Payne-Lowe Research Center,BR,Brazil
si_0522,"Becker, Lara and Baker Research Center",BR,Brazil
si_0523,Lee-Wright Research Center,BR,Brazil
si_0524,"Evans, David and Hendrix Research Center",BR,Brazil
si_0525,Bush-Vaughn Research Center,BR,Brazil
si_0526,Stewart-Bailey Research Center,BR,Brazil
si_0527,"Hill, Martinez and Rhodes Research Center",BR,Brazil
si_0528,Huang-Foster Research Center,KR,South Korea
si_0529,Blevins-Ballard Research Center,KR,South Korea
si_0530,Williams-Moses Research Center,KR,South Korea
si_0531,Reed Group Research Center,KR,South Korea
si_0532,"Scott, Mendoza and Harris Research Center",KR,South Korea
si_0533,"Nelson, Hoffman and Nelson Research Center",KR,South Korea
si_0534,Gilbert PLC Research Center,KR,South Korea
si_0535,Sanchez Ltd Research Center,KR,South Korea
si_0536,"Perez, Hall and Garcia Research Center",KR,South Korea
si_0537,Love-Garcia Research Center,KR,South Korea
si_0538,Smith PLC Research Center,KR,South Korea
si_0539,Russell Group Research Center,KR,South Korea
si_0540,Santos-Avila Research Center,KR,South Korea
si_0541,Morris-Brewer Research Center,KR,South Korea
si_0542,Pearson and Sons Research Center,KR,South Korea
si_0543,"Rodgers, Jefferson and Johnson Research Center",KR,South Korea
si_0544,Butler and Sons Research Center,IN,India
si_0545,Osborn Group Research Center,IN,India
si_0546,Lopez-Curry Research Center,IN,India
si_0547,Mcdowell-Smith Research Center,IN,India
si_0548,"Morrison, Hebert and Rogers Research Center",IN,India
si_0549,Hays-Daniels Research Center,IN,India
si_0550,Small-Anderson Research Center,IN,India
si_0551,"Mcdonald, Lee and Rodriguez Research Center",IN,India
si_0552,Simon Ltd Research Center,IN,India
si_0553,Higgins-Smith Research Center,IN,India
si_0554,Gibbs-Bradley Research Center,IN,India
si_0555,Thompson Ltd Research Center,IN,India
si_0556,Wilcox-Robertson Research Center,IN,India
si_0557,Morales Inc Research Center,IN,India
si_0558,Holden Group Research Center,IN,India
si_0559,Boyle-Smith Research Center,IN,India
si_0560,Young-Molina Research Center,IN,India
si_0561,Turner-Sharp Research Center,IN,India
si_0562,Green LLC Research Center,IN,India
si_0563,"Young, Contreras and Marshall Research Center",IN,India
si_0564,Sullivan PLC Research Center,IN,India
si_0565,"Carrillo, Vaughn and Fowler Research Center",IN,India
si_0566,Richardson-Walker Research Center,IN,India
si_0567,Mendoza Group Research Center,IN,India
si_0568,"Zhang, Brooks and Miles Research Center",MX,Mexico
si_0569,Todd-Pham Research Center,MX,Mexico
si_0570,Gill Ltd Research Center,MX,Mexico
si_0571,"Marks, Miller and Griffin Research Center",MX,Mexico
si_0572,"Cox, Stark and Rodriguez Research Center",MX,Mexico
si_0573,"Leach, Harris and Herrera Research Center",MX,Mexico
si_0574,Murphy PLC Research Center,MX,Mexico
si_0575,Wilson-Harris Research Center,MX,Mexico
si_0576,"Burns, Nolan and Griffin Research Center",MX,Mexico
si_0577,Chavez PLC Research Center,MX,Mexico
si_0578,Bryant-Brown Research Center,MX,Mexico
si_0579,Chambers-Parker Research Center,MX,Mexico
si_0580,Foster Inc Research Center,MX,Mexico
si_0581,"Robinson, Jones and Henderson Research Center",MX,Mexico
si_0582,"Brown, Mcknight and Michael Research Center",MX,Mexico
si_0583,Andersen Group Research Center,MX,Mexico
si_0584,Mitchell and Sons Research Center,MX,Mexico
si_0585,Cannon Ltd Research Center,MX,Mexico
si_0586,"Stuart, Brooks and Vance Research Center",MX,Mexico
si_0587,Kane-Knox Research Center,MX,Mexico
si_0588,Miller-Brandt Research Center,MX,Mexico
si_0589,"Anderson, Dalton and Wilson Research Center",ZA,South Africa
si_0590,"Long, Anderson and Irwin Research Center",ZA,South Africa
si_0591,Avila LLC Research Center,ZA,South Africa
si_0592,Nunez-Stephens Research Center,ZA,South Africa
si_0593,"Gray, Hall and Murray Research Center",ZA,South Africa
si_0594,Hill Ltd Research Center,ZA,South Africa
si_0595,Johnson Ltd Research Center,ZA,South Africa
si_0596,Mendez-Mayer Research Center,ZA,South Africa
si_0597,Allen Inc Research Center,ZA,South Africa
si_0598,Wheeler Group Research Center,ZA,South Africa
si_0599,"Powers, Brennan and Sanchez Research Center",PL,Poland
si_0600,Morales and Sons Research Center,PL,Poland
si_0601,"Robinson, Shields and Brown Research Center",PL,Poland
si_0602,"Holder, Young and Hendricks Research Center",PL,Poland
si_0603,"Flores, Harper and Chambers Research Center",PL,Poland
si_0604,Young-Walter Research Center,PL,Poland
si_0605,"Boyd, Gutierrez and Hill Research Center",PL,Poland
si_0606,"Fry, Hobbs and Buck Research Center",PL,Poland
si_0607,"Shelton, Peters and Williams Research Center",PL,Poland
si_0608,David-Powers Research Center,PL,Poland
si_0609,"Flores, Butler and Hernandez Research Center",PL,Poland
si_0610,White-Medina Research Center,PL,Poland
si_0611,Atkinson LLC Research Center,PL,Poland
si_0612,"Thomas, Ford and Brown Research Center",PL,Poland
si_0613,Faulkner-Grant Research Center,PL,Poland
si_0614,Price LLC Research Center,PL,Poland
si_0615,Rivera Inc Research Center,PL,Poland
si_0616,Boone-Davis Research Center,PL,Poland
si_0617,"Calderon, Williams and Bennett Research Center",PL,Poland
si_0618,"Morrison, Russo and Lopez Research Center",PL,Poland
si_0619,"Ramsey, Hansen and Mendoza Research Center",PL,Poland
si_0620,Turner-Stout Research Center,PL,Poland
si_0621,Giles Ltd Research Center,NL,Netherlands
si_0622,Burgess Group Research Center,NL,Netherlands
si_0623,Dominguez Ltd Research Center,NL,Netherlands
si_0624,Sanders and Sons Research Center,NL,Netherlands
si_0625,"Morris, Campbell and Owens Research Center",NL,Netherlands
si_0626,"Howard, Green and Hunt Research Center",NL,Netherlands
si_0627,Owens-Lang Research Center,NL,Netherlands
si_0628,"Harrison, Franco and Rocha Research Center",NL,Netherlands
si_0629,Edwards-Williams Research Center,NL,Netherlands
si_0630,Figueroa Inc Research Center,NL,Netherlands
si_0631,Tran-Silva Research Center,NL,Netherlands
si_0632,"Butler, Hernandez and Rivera Research Center",NL,Netherlands
si_0633,Hudson-Sanchez Research Center,NL,Netherlands
si_0634,"Pena, Cohen and Scott Research Center",NL,Netherlands
si_0635,Levy-May Research Center,NL,Netherlands
si_0636,Murray-Oconnor Research Center,BE,Belgium
si_0637,Jackson-Cortez Research Center,BE,Belgium
si_0638,White-Preston Research Center,BE,Belgium
si_0639,"Bernard, Warren and Combs Research Center",BE,Belgium
si_0640,Landry Ltd Research Center,BE,Belgium
si_0641,Duran Group Research Center,BE,Belgium
si_0642,Kirby and Sons Research Center,BE,Belgium
si_0643,Mann Inc Research Center,BE,Belgium
si_0644,Wagner LLC Research Center,BE,Belgium
si_0645,Williamson Ltd Research Center,BE,Belgium
si_0646,"Durham, Hopkins and Smith Research Center",BE,Belgium
si_0647,"Arnold, Smith and Moreno Research Center",BE,Belgium
si_0648,Nichols-Mitchell Research Center,BE,Belgium
si_0649,"Li, Craig and Drake Research Center",BE,Belgium
si_0650,Rodriguez Inc Research Center,BE,Belgium
si_0651,"Hernandez, Lee and Fox Research Center",BE,Belgium
si_0652,Adams-Sanders Research Center,BE,Belgium
si_0653,Chung-Stevens Research Center,BE,Belgium
si_0654,Branch and Sons Research Center,BE,Belgium
si_0655,Sutton-Abbott Research Center,BE,Belgium
si_0656,"Frey, Santos and Johnson Research Center",BE,Belgium
si_0657,Gray-Tran Research Center,AR,Argentina
si_0658,Walsh Ltd Research Center,AR,Argentina
si_0659,Miller Group Research Center,AR,Argentina
si_0660,"Mueller, Knight and Hodge Research Center",AR,Argentina
si_0661,Jacobson Inc Research Center,AR,Argentina
si_0662,Lewis Ltd Research Center,AR,Argentina
si_0663,"Alvarez, Williams and Jones Research Center",AR,Argentina
si_0664,Lam-Elliott Research Center,AR,Argentina
si_0665,White LLC Research Center,AR,Argentina
si_0666,Ali PLC Research Center,AR,Argentina
si_0667,Goodwin Ltd Research Center,AR,Argentina
si_0668,Hickman-Evans Research Center,AR,Argentina
si_0669,"Allen, Davenport and Price Research Center",AR,Argentina
si_0670,"Rivera, Campos and Taylor Research Center",CL,Chile
si_0671,"Ramsey, Mason and Mccann Research Center",CL,Chile
si_0672,Davis and Sons Research Center,CL,Chile
si_0673,Peterson PLC Research Center,CL,Chile
si_0674,"Sanders, Ayala and Johnson Research Center",CL,Chile
si_0675,Bowers-Hayes Research Center,CL,Chile
si_0676,Kelly Group Research Center,CL,Chile
si_0677,Lopez-Willis Research Center,CL,Chile
si_0678,Miller-Montgomery Research Center,CL,Chile
si_0679,Marquez Inc Research Center,CL,Chile
si_0680,Moore-Dawson Research Center,CL,Chile
si_0681,"Moore, Price and Ward Research Center",CL,Chile
si_0682,Smith LLC Research Center,CL,Chile
si_0683,Ward-Nelson Research Center,CL,Chile
si_0684,Miller Group Research Center,CL,Chile
si_0685,Hawkins-Hunt Research Center,CL,Chile
si_0686,Johnson LLC Research Center,CL,Chile
si_0687,"Davis, George and Nguyen Research Center",TW,Taiwan
si_0688,Smith-Gutierrez Research Center,TW,Taiwan
si_0689,Hardy PLC Research Center,TW,Taiwan
si_0690,Armstrong and Sons Research Center,TW,Taiwan
si_0691,"James, Taylor and Turner Research Center",TW,Taiwan
si_0692,Thomas-Jackson Research Center,TW,Taiwan
si_0693,Fisher-Washington Research Center,TW,Taiwan
si_0694,Ward and Sons Research Center,TW,Taiwan
si_0695,"Weber, Wheeler and Gonzalez Research Center",TW,Taiwan
si_0696,Taylor Inc Research Center,TW,Taiwan
si_0697,Cook-Oliver Research Center,TW,Taiwan
si_0698,Alexander-Jordan Research Center,TW,Taiwan
si_0699,"Mccann, Taylor and Flores Research Center",TW,Taiwan
si_0700,"Harris, Edwards and Oconnell Research Center",IL,Israel
si_0701,Carter-Neal Research Center,IL,Israel
si_0702,Faulkner-Casey Research Center,IL,Israel
si_0703,Bennett-Velasquez Research Center,IL,Israel
si_0704,Diaz-Frederick Research Center,IL,Israel
si_0705,Vargas PLC Research Center,IL,Israel
si_0706,Maldonado PLC Research Center,IL,Israel
si_0707,Benton Group Research Center,IL,Israel
si_0708,"Clark, Salinas and Guerra Research Center",IL,Israel
si_0709,Fuentes Group Research Center,IL,Israel
si_0710,"Porter, Schultz and Allen Research Center",IL,Israel
si_0711,"Moore, Henderson and Bennett Research Center",IL,Israel
si_0712,Ewing-Mendoza Research Center,IL,Israel
si_0713,Ferguson-Mclean Research Center,IL,Israel
si_0714,"Barnes, Johnson and Schmitt Research Center",IL,Israel
si_0715,"Woodard, Herrera and Little Research Center",IL,Israel
si_0716,Rodriguez and Sons Research Center,CZ,Czech Republic
si_0717,"Ortega, Jackson and Salazar Research Center",CZ,Czech Republic
si_0718,"Terrell, Byrd and Ross Research Center",CZ,Czech Republic
si_0719,Sheppard-Jordan Research Center,CZ,Czech Republic
si_0720,Garcia and Sons Research Center,CZ,Czech Republic
si_0721,"Burgess, Grant and Watts Research Center",CZ,Czech Republic
si_0722,Griffin Group Research Center,CZ,Czech Republic
si_0723,Barton-Chapman Research Center,CZ,Czech Republic
si_0724,"Hernandez, Cuevas and Webb Research Center",CZ,Czech Republic
si_0725,Perry-Nixon Research Center,CZ,Czech Republic
si_0726,Guerra Ltd Research Center,CZ,Czech Republic
si_0727,Bailey LLC Research Center,CZ,Czech Republic
si_0728,Mueller-Boyd Research Center,CZ,Czech Republic
si_0729,Alvarez-Kim Research Center,CZ,Czech Republic
si_0730,"Chavez, Jones and Williams Research Center",CZ,Czech Republic
si_0731,"Wilson, Sweeney and Wong Research Center",CZ,Czech Republic
si_0732,"Marsh, Spears and Yang Research Center",HU,Hungary
si_0733,"Thompson, Moore and Castro Research Center",HU,Hungary
si_0734,Hall-Sullivan Research Center,HU,Hungary
si_0735,Lopez Ltd Research Center,HU,Hungary
si_0736,Foster-Mclaughlin Research Center,HU,Hungary
si_0737,Cole Group Research Center,HU,Hungary
si_0738,Smith-Lewis Research Center,HU,Hungary
si_0739,Goodwin-Stokes Research Center,HU,Hungary
si_0740,Ray PLC Research Center,HU,Hungary
si_0741,Diaz and Sons Research Center,HU,Hungary
si_0742,Wilson-Lambert Research Center,HU,Hungary
si_0743,Rose-Fowler Research Center,HU,Hungary
si_0744,"Price, Long and Wilson Research Center",TH,Thailand
si_0745,Bruce-Williamson Research Center,TH,Thailand
si_0746,"Mccarthy, Evans and Mendez Research Center",TH,Thailand
si_0747,Powers LLC Research Center,TH,Thailand
si_0748,Allen Inc Research Center,TH,Thailand
si_0749,Brooks and Sons Research Center,TH,Thailand
si_0750,"Price, Carlson and Andrews Research Center",TH,Thailand
si_0751,Lopez-Reid Research Center,TH,Thailand
si_0752,"Ellison, Arias and Thompson Research Center",TH,Thailand
si_0753,Burns and Sons Research Center,TH,Thailand
si_0754,Edwards Group Research Center,TH,Thailand
si_0755,"Brown, Howard and Smith Research Center",TH,Thailand
si_0756,Lee Group Research Center,TH,Thailand
si_0757,"Wagner, Simpson and Cohen Research Center",RU,Russia
si_0758,Mckinney-Wallace Research Center,RU,Russia
si_0759,Miller Inc Research Center,RU,Russia
si_0760,Carter LLC Research Center,RU,Russia
si_0761,Medina and Sons Research Center,RU,Russia
si_0762,Cunningham-Barton Research Center,RU,Russia
si_0763,Dunn-Wilson Research Center,RU,Russia
si_0764,Adams PLC Research Center,RU,Russia
si_0765,Weaver-Sherman Research Center,RU,Russia
si_0766,"Alexander, Robinson and Coleman Research Center",CO,Colombia
si_0767,"Greer, Potter and Evans Research Center",CO,Colombia
si_0768,Cole LLC Research Center,CO,Colombia
si_0769,Gonzales Inc Research Center,CO,Colombia
si_0770,Clark Ltd Research Center,CO,Colombia
si_0771,"Norris, Callahan and Bishop Research Center",CO,Colombia
si_0772,Martin-Taylor Research Center,CO,Colombia
si_0773,Li Inc Research Center,CO,Colombia
si_0774,"Bell, Campbell and Ryan Research Center",CO,Colombia
si_0775,Werner-Carter Research Center,CO,Colombia
si_0776,"Adams, Hodge and Duke Research Center",CO,Colombia
si_0777,"Ochoa, Taylor and Brady Research Center",PH,Philippines
si_0778,Sellers-Riddle Research Center,PH,Philippines
si_0779,"Martinez, Cline and Wright Research Center",PH,Philippines
si_0780,"Morris, Wright and Bridges Research Center",PH,Philippines
si_0781,Burns-Ray Research Center,PH,Philippines
si_0782,Burton-Brooks Research Center,PH,Philippines
si_0783,Schultz Inc Research Center,PH,Philippines
si_0784,Robertson-Ramirez Research Center,PH,Philippines
si_0785,Gibson-Freeman Research Center,PH,Philippines
si_0786,"Smith, Schroeder and Oconnor Research Center",EG,Egypt
si_0787,"Stanton, Reid and Terry Research Center",EG,Egypt
si_0788,Flynn Group Research Center,EG,Egypt
si_0789,Donaldson and Sons Research Center,EG,Egypt
si_0790,Adams-Clayton Research Center,EG,Egypt
si_0791,Kelley-Anderson Research Center,SE,Sweden
si_0792,Kramer-Shannon Research Center,SE,Sweden
si_0793,Williams Ltd Research Center,SE,Sweden
si_0794,Smith-Noble Research Center,SE,Sweden
si_0795,Alexander Inc Research Center,SE,Sweden
si_0796,Harris-Barker Research Center,SE,Sweden
si_0797,Khan LLC Research Center,SE,Sweden
si_0798,Baxter LLC Research Center,DK,Denmark
si_0799,Pena LLC Research Center,DK,Denmark
si_0800,Watson Ltd Research Center,DK,Denmark
